{
  "trajectoryId": "11111111-1111-1111-1111-111111111111",
  "cascadeId": "22222222-2222-2222-2222-222222222222",
  "trajectoryType": "CORTEX_TRAJECTORY_TYPE_CASCADE",
  "source": "CORTEX_TRAJECTORY_SOURCE_CLI",
  "steps": [
    {
      "type": "CORTEX_STEP_TYPE_RUN_COMMAND",
      "status": "CORTEX_STEP_STATUS_ERROR",
      "metadata": {
        "createdAt": "2026-01-01T00:00:00.000000000Z",
        "source": "CORTEX_STEP_SOURCE_MODEL",
        "executionId": "33333333-3333-3333-3333-333333333333"
      },
      "error": {
        "shortError": "tool call denied by pre-tool hook: audit-hook: blocked by the workspace hook",
        "fullError": "tool call denied by pre-tool hook: audit-hook: blocked by the workspace hook"
      },
      "runCommand": {
        "commandLine": "echo HOOK_DENIED",
        "proposedCommandLine": "echo HOOK_DENIED",
        "cwd": "/workspace",
        "blocking": true,
        "combinedOutput": {}
      }
    }
  ]
}
