{
  "trajectoryId": "11111111-1111-1111-1111-111111111111",
  "cascadeId": "22222222-2222-2222-2222-222222222222",
  "trajectoryType": "CORTEX_TRAJECTORY_TYPE_CASCADE",
  "source": "CORTEX_TRAJECTORY_SOURCE_CLI",
  "steps": [
    {
      "type": "CORTEX_STEP_TYPE_RUN_COMMAND",
      "status": "CORTEX_STEP_STATUS_CANCELED",
      "metadata": {
        "createdAt": "2026-01-01T00:00:00.000000000Z",
        "source": "CORTEX_STEP_SOURCE_MODEL",
        "executionId": "33333333-3333-3333-3333-333333333333",
        "internalMetadata": {
          "statusTransitions": [
            {"updatedStatus": "CORTEX_STEP_STATUS_PENDING", "timestamp": "2026-01-01T00:00:00.100000000Z"},
            {"updatedStatus": "CORTEX_STEP_STATUS_RUNNING", "timestamp": "2026-01-01T00:00:00.101000000Z"},
            {"updatedStatus": "CORTEX_STEP_STATUS_WAITING", "timestamp": "2026-01-01T00:00:00.102000000Z"},
            {"updatedStatus": "CORTEX_STEP_STATUS_RUNNING", "timestamp": "2026-01-01T00:00:40.900000000Z"},
            {"updatedStatus": "CORTEX_STEP_STATUS_CANCELED", "timestamp": "2026-01-01T00:00:40.901000000Z"}
          ]
        },
        "preToolHookResults": [{"decision": "allow"}]
      },
      "runCommand": {
        "commandLine": "echo PERMISSION_CANCELED",
        "proposedCommandLine": "echo PERMISSION_CANCELED",
        "cwd": "/workspace",
        "blocking": true,
        "combinedOutput": {}
      }
    }
  ]
}
