{
  "trajectoryId": "11111111-1111-1111-1111-111111111111",
  "cascadeId": "22222222-2222-2222-2222-222222222222",
  "trajectoryType": "CORTEX_TRAJECTORY_TYPE_CASCADE",
  "source": "CORTEX_TRAJECTORY_SOURCE_CLI",
  "steps": [
    {
      "type": "CORTEX_STEP_TYPE_PLANNER_RESPONSE",
      "status": "CORTEX_STEP_STATUS_DONE",
      "metadata": {
        "createdAt": "2026-01-01T00:00:00.000000000Z",
        "source": "CORTEX_STEP_SOURCE_MODEL",
        "executionId": "33333333-3333-3333-3333-333333333333"
      },
      "plannerResponse": {
        "messageId": "44444444-4444-4444-4444-444444444444",
        "stopReason": "CORTEX_STOP_REASON_TOOL_USE",
        "toolCalls": [
          {
            "name": "invoke_subagent",
            "argumentsJson": "{\"Subagents\":[{\"Prompt\":\"Create a placeholder file in the workspace.\"}]}"
          }
        ]
      }
    },
    {
      "type": "CORTEX_STEP_TYPE_INVOKE_SUBAGENT",
      "status": "CORTEX_STEP_STATUS_DONE",
      "metadata": {
        "createdAt": "2026-01-01T00:00:01.000000000Z",
        "source": "CORTEX_STEP_SOURCE_MODEL",
        "executionId": "55555555-5555-5555-5555-555555555555",
        "sourceTrajectoryStepInfo": {
          "trajectoryId": "11111111-1111-1111-1111-111111111111",
          "stepIndex": 5,
          "metadataIndex": 1,
          "cascadeId": "22222222-2222-2222-2222-222222222222"
        },
        "internalMetadata": {
          "statusTransitions": [
            {
              "updatedStatus": "CORTEX_STEP_STATUS_PENDING",
              "timestamp": "2026-01-01T00:00:01.100000000Z"
            },
            {
              "updatedStatus": "CORTEX_STEP_STATUS_RUNNING",
              "timestamp": "2026-01-01T00:00:01.200000000Z"
            },
            {
              "updatedStatus": "CORTEX_STEP_STATUS_DONE",
              "timestamp": "2026-01-01T00:00:01.300000000Z"
            }
          ]
        }
      }
    },
    {
      "type": "CORTEX_STEP_TYPE_PLANNER_RESPONSE",
      "status": "CORTEX_STEP_STATUS_DONE",
      "metadata": {
        "createdAt": "2026-01-01T00:00:02.000000000Z",
        "source": "CORTEX_STEP_SOURCE_MODEL",
        "executionId": "66666666-6666-6666-6666-666666666666"
      },
      "plannerResponse": {
        "messageId": "77777777-7777-7777-7777-777777777777",
        "response": "I invoked the subagent and am waiting for it to finish.",
        "stopReason": "CORTEX_STOP_REASON_END_TURN"
      }
    }
  ],
  "metadata": {
    "createdAt": "2026-01-01T00:00:00.000000000Z"
  }
}
